transaction_id,old_parent,old_president_name,new_parent,new_president_name,child,type,date
2403-03_tr_01,Ranil Wickremesinghe,Ranil Wickremesinghe,Anura Kumara Dissanayake,Anura Kumara Dissanayake,Minister of Defence,minister,2024-09-23
2403-03_tr_02,Ranil Wickremesinghe,Ranil Wickremesinghe,Anura Kumara Dissanayake,Anura Kumara Dissanayake,"Minister of Finance, Economic Stabilization and National Policies",minister,2024-09-23
2403-03_tr_03,Ranil Wickremesinghe,Ranil Wickremesinghe,Anura Kumara Dissanayake,Anura Kumara Dissanayake,Minister of Technology,minister,2024-09-23
2403-03_tr_04,Ranil Wickremesinghe,Ranil Wickremesinghe,Anura Kumara Dissanayake,Anura Kumara Dissanayake,"Minister of Women, Child Affairs and Social Empowerment",minister,2024-09-23
2403-03_tr_05,Ranil Wickremesinghe,Ranil Wickremesinghe,Anura Kumara Dissanayake,Anura Kumara Dissanayake,"Minister of Ports, Shipping and Aviation",minister,2024-09-23
2403-03_tr_06,Ranil Wickremesinghe,Ranil Wickremesinghe,Anura Kumara Dissanayake,Anura Kumara Dissanayake,Minister of Investment Promotion,minister,2024-09-23
2403-03_tr_07,Ranil Wickremesinghe,Ranil Wickremesinghe,Anura Kumara Dissanayake,Anura Kumara Dissanayake,"Minister of Public Administration, Home Affairs, Provincial Councils and Local Government",minister,2024-09-23
2403-03_tr_08,Ranil Wickremesinghe,Ranil Wickremesinghe,Anura Kumara Dissanayake,Anura Kumara Dissanayake,Minister of Fisheries,minister,2024-09-23
2403-03_tr_09,Ranil Wickremesinghe,Ranil Wickremesinghe,Anura Kumara Dissanayake,Anura Kumara Dissanayake,Minister of Education,minister,2024-09-23
2403-03_tr_10,Ranil Wickremesinghe,Ranil Wickremesinghe,Anura Kumara Dissanayake,Anura Kumara Dissanayake,Minister of Transport and Highways,minister,2024-09-23
2403-03_tr_11,Ranil Wickremesinghe,Ranil Wickremesinghe,Anura Kumara Dissanayake,Anura Kumara Dissanayake,Minister of Mass Media,minister,2024-09-23
2403-03_tr_12,Ranil Wickremesinghe,Ranil Wickremesinghe,Anura Kumara Dissanayake,Anura Kumara Dissanayake,Minister of Health,minister,2024-09-23
2403-03_tr_13,Ranil Wickremesinghe,Ranil Wickremesinghe,Anura Kumara Dissanayake,Anura Kumara Dissanayake,Minister of Water Supply and Estate Infrastructure Development,minister,2024-09-23
2403-03_tr_14,Ranil Wickremesinghe,Ranil Wickremesinghe,Anura Kumara Dissanayake,Anura Kumara Dissanayake,Minister of Agriculture and Plantation Industries,minister,2024-09-23
2403-03_tr_15,Ranil Wickremesinghe,Ranil Wickremesinghe,Anura Kumara Dissanayake,Anura Kumara Dissanayake,Minister of Wildlife and Forest Resources Conservation,minister,2024-09-23
2403-03_tr_16,Ranil Wickremesinghe,Ranil Wickremesinghe,Anura Kumara Dissanayake,Anura Kumara Dissanayake,"Minister of Justice, Prisons Affairs and Constitutional Reforms",minister,2024-09-23
2403-03_tr_17,Ranil Wickremesinghe,Ranil Wickremesinghe,Anura Kumara Dissanayake,Anura Kumara Dissanayake,Minister of Tourism and Lands,minister,2024-09-23
2403-03_tr_18,Ranil Wickremesinghe,Ranil Wickremesinghe,Anura Kumara Dissanayake,Anura Kumara Dissanayake,Minister of Industries,minister,2024-09-23
2403-03_tr_19,Ranil Wickremesinghe,Ranil Wickremesinghe,Anura Kumara Dissanayake,Anura Kumara Dissanayake,Minister of Urban Development and Housing,minister,2024-09-23
2403-03_tr_20,Ranil Wickremesinghe,Ranil Wickremesinghe,Anura Kumara Dissanayake,Anura Kumara Dissanayake,Minister of Foreign Affairs,minister,2024-09-23
2403-03_tr_21,Ranil Wickremesinghe,Ranil Wickremesinghe,Anura Kumara Dissanayake,Anura Kumara Dissanayake,"Minister of Buddhasasana, Religious and Cultural Affairs",minister,2024-09-23
2403-03_tr_22,Ranil Wickremesinghe,Ranil Wickremesinghe,Anura Kumara Dissanayake,Anura Kumara Dissanayake,Minister of Power and Energy,minister,2024-09-23
2403-03_tr_23,Ranil Wickremesinghe,Ranil Wickremesinghe,Anura Kumara Dissanayake,Anura Kumara Dissanayake,Minister of Environment,minister,2024-09-23
2403-03_tr_24,Ranil Wickremesinghe,Ranil Wickremesinghe,Anura Kumara Dissanayake,Anura Kumara Dissanayake,Minister of Sports and Youth Affairs,minister,2024-09-23
2403-03_tr_25,Ranil Wickremesinghe,Ranil Wickremesinghe,Anura Kumara Dissanayake,Anura Kumara Dissanayake,Minister of Irrigation,minister,2024-09-23
2403-03_tr_26,Ranil Wickremesinghe,Ranil Wickremesinghe,Anura Kumara Dissanayake,Anura Kumara Dissanayake,Minister of Labour and Foreign Employment,minister,2024-09-23
2403-03_tr_27,Ranil Wickremesinghe,Ranil Wickremesinghe,Anura Kumara Dissanayake,Anura Kumara Dissanayake,Minister of Public Security,minister,2024-09-23
2403-03_tr_28,Ranil Wickremesinghe,Ranil Wickremesinghe,Anura Kumara Dissanayake,Anura Kumara Dissanayake,"Minister of Trade, Commerce and Food Security",minister,2024-09-23
2403-03_tr_29,Ranil Wickremesinghe,Ranil Wickremesinghe,Anura Kumara Dissanayake,Anura Kumara Dissanayake,State Minister of Higher Education,minister,2024-09-23
2403-03_tr_30,Ranil Wickremesinghe,Ranil Wickremesinghe,Anura Kumara Dissanayake,Anura Kumara Dissanayake,Non Cabinet Minister of State Plantation Enterprises Reforms,minister,2024-09-23
2403-03_tr_31,Ranil Wickremesinghe,Ranil Wickremesinghe,Anura Kumara Dissanayake,Anura Kumara Dissanayake,State Minister of Sports and Youth Affairs,minister,2024-09-23
2403-03_tr_32,Ranil Wickremesinghe,Ranil Wickremesinghe,Anura Kumara Dissanayake,Anura Kumara Dissanayake,Non Cabinet Minister of Development Projects,minister,2024-09-23